{
  "$schema": "./metric-spec.schema.json",
  "schema": "semantic-dark.paired-theme-metric-spec.v1",
  "id": "semantic-dark.paired-theme-metric.v1",
  "version": 1,
  "status": "frozen",
  "baseline": {
    "m0Manifest": "fixtures/evaluation/m0-manifest.v1.json",
    "m0ManifestSha256": "69efa054f742c58b7c69e6d64bca51e04e67ef730ac67ac980a3ddff854bb205",
    "engineCommit": "de53f773963af17c889054c690c4f79cf8fd7d12",
    "roleProfilesSource": "src/color/dark-map.ts",
    "roleProfilesSourceSha256": "671290dd0365d94efcc485ea137a7b0e433e784cbee20ea3dc2a437aa6dbb53d",
    "roleProfilesCanonicalSha256": "e6fd84a659b23272bfac8049abf7f5711b96abff793029340fdc942313fe6cb5"
  },
  "sources": [
    {"system": "material", "split": "reference", "protocol": "fixtures/paired-theme/material-v1.protocol.json", "package": {"name": "@material/material-color-utilities", "version": "0.4.0", "integrity": "sha512-dlq6VExJReb8dhjj3a/yTigr3ncNwoFmL5Iy2ENtbDX03EmNeOEdZ+vsaGrj7RTuO+mB7L58II4LCsl4NpM8uw==", "license": "Apache-2.0", "repository": "https://github.com/material-foundation/material-color-utilities"}, "mappingPolicy": "generated-scheme"},
    {"system": "primer", "split": "reference", "protocol": "fixtures/paired-theme/primer-v1.protocol.json", "package": {"name": "@primer/primitives", "version": "11.9.0", "integrity": "sha512-yESOalhd7s7S3unV1V32v3Z0RszXiiz6pzy6hVI9xpdTh1q1Gt8vyDFxRlqIvuwc5ZaO1+gYQTDbjxb4nWBzMw==", "license": "MIT", "repository": "https://github.com/primer/primitives"}, "mappingPolicy": "precommitted-semantic-token-names"},
    {"system": "spectrum", "split": "reference", "protocol": "fixtures/paired-theme/spectrum-v1.protocol.json", "package": {"name": "@adobe/spectrum-design-data", "version": "0.12.0", "integrity": "sha512-R1Nso0lDPrev//uBuxWlTsCZ1aJtlNxnF0rTnEYr9ykgzeMI9sw9nWakmqWFcy+KzF39kncDxkIOG6en/UyWQA==", "license": "Apache-2.0", "repository": "https://github.com/adobe/spectrum-design-data"}, "mappingPolicy": "precommitted-uuid-roots"},
    {"system": "carbon", "split": "held-out", "protocol": "fixtures/paired-theme/carbon-v1.protocol.json", "package": {"name": "@carbon/themes", "version": "11.77.0", "integrity": "sha512-5MGfcWiKwpIAmmtq4zlAeSkGkECaVXhr61Ol0EUFQskUlhAgeKhlIc5iWXFmwDb25oxzEFo0puH+GKsLL4GN/w==", "license": "Apache-2.0", "repository": "https://github.com/carbon-design-system/carbon"}, "mappingPolicy": "precommitted-semantic-token-names"},
    {"system": "fluent", "split": "held-out", "protocol": "fixtures/paired-theme/fluent-v1.protocol.json", "package": {"name": "@fluentui/react-theme", "version": "9.2.1", "integrity": "sha512-lJxfz7LmmglFz+c9C41qmMqaRRZZUPtPPl9DWQ79vH+JwZd4dkN7eA78OTRwcGCOTPEKoLTX72R+EFaWEDlX+w==", "license": "MIT", "repository": "https://github.com/microsoft/fluentui"}, "mappingPolicy": "precommitted-semantic-token-names"}
  ],
  "records": {
    "sceneManifest": "fixtures/paired-theme/common-scenes.v1.json",
    "sceneManifestSha256": "b0814578db41ad03cb251369058ce41cbfa63d27da51793ac296368ed0ced754",
    "systems": ["material", "primer", "spectrum", "carbon", "fluent"],
    "identity": "system/sceneId/paintId",
    "reviewed": [
      {"sceneId": "surface-stack", "paintId": "surface.canvas", "role": "background", "token": "canvas"},
      {"sceneId": "surface-stack", "paintId": "surface.raised", "role": "surface", "token": "surfaceRaised"},
      {"sceneId": "surface-stack", "paintId": "surface.title", "role": "text", "token": "textPrimary"},
      {"sceneId": "table-selection", "paintId": "table.header", "role": "surface", "token": "tableHeader"},
      {"sceneId": "table-selection", "paintId": "table.selected", "role": "accent", "token": "selectedSurface"},
      {"sceneId": "table-selection", "paintId": "table.text", "role": "text", "token": "textPrimary"},
      {"sceneId": "form-focus", "paintId": "form.border", "role": "border", "token": "border"},
      {"sceneId": "form-focus", "paintId": "form.focus", "role": "accent", "token": "focus"},
      {"sceneId": "status-alert", "paintId": "status.surface", "role": "surface", "token": "dangerSurface"},
      {"sceneId": "status-alert", "paintId": "status.text", "role": "text", "token": "dangerText"}
    ],
    "contrast": [
      {"sceneId": "surface-stack", "paintId": "surface.title", "role": "text", "kind": "text", "backdropPaintId": "surface.raised"},
      {"sceneId": "table-selection", "paintId": "table.selected", "role": "accent", "kind": "non-text", "backdropPaintId": "table.canvas"},
      {"sceneId": "table-selection", "paintId": "table.text", "role": "text", "kind": "text", "backdropPaintId": "table.header"},
      {"sceneId": "form-focus", "paintId": "form.border", "role": "border", "kind": "non-text", "backdropPaintId": "form.surface"},
      {"sceneId": "form-focus", "paintId": "form.focus", "role": "accent", "kind": "non-text", "backdropPaintId": "form.surface"},
      {"sceneId": "status-alert", "paintId": "status.text", "role": "text", "kind": "text", "backdropPaintId": "status.surface"}
    ],
    "rank": [
      {"sceneId": "surface-stack", "pairId": "surface.card-to-raised", "lowerPaintId": "surface.card", "upperPaintId": "surface.raised"},
      {"sceneId": "table-selection", "pairId": "table.canvas-to-header", "lowerPaintId": "table.canvas", "upperPaintId": "table.header"},
      {"sceneId": "status-alert", "pairId": "status.canvas-to-surface", "lowerPaintId": "status.canvas", "upperPaintId": "status.surface"}
    ],
    "aggregationCells": {
      "colorRoleScene": ["background/surface-stack", "surface/surface-stack", "text/surface-stack", "surface/table-selection", "accent/table-selection", "text/table-selection", "border/form-focus", "accent/form-focus", "surface/status-alert", "text/status-alert"],
      "contrastRoleScene": ["text/surface-stack", "accent/table-selection", "text/table-selection", "border/form-focus", "accent/form-focus", "text/status-alert"],
      "rankScenes": ["surface-stack", "table-selection", "status-alert"],
      "emptyCellPolicy": "a-preregistered-empty-cell-invalidates-the-run"
    },
    "totals": {"systems": 5, "scenesPerSystem": 4, "paintsPerVariant": 15, "observationsPerSystem": 45, "reviewedPerSystem": 10, "totalReviewedRows": 50, "colorRowsPerSystem": 10, "totalColorRows": 50, "contrastRowsPerSystem": 6, "totalContrastRows": 30, "rankRowsPerSystem": 3, "totalRankRows": 15},
    "missingPolicy": "invalidate-run",
    "extraPolicy": "invalidate-run",
    "duplicatePolicy": "invalidate-run",
    "abstentionPolicy": "score-unchanged-light-paint; extraction-failure-is-not-abstention"
  },
  "colorPipeline": {"space": "computed-srgb", "source": "fresh-headless-chrome-computed-style", "alpha": "gamma-encoded-srgb-source-over-recorded-backdrop-until-opaque", "contrast": "WCAG-relative-luminance-after-effective-paint-compositing"},
  "primary": {
    "color": {"formula": "d_i=min(Euclidean_OKLab(candidate_i,authored_dark_i)/0.10,1)", "cap": 0.1},
    "contrast": {"formula": "c_i=min(abs(log2(candidate_contrast_i/authored_contrast_i)),1)", "cap": 1},
    "rank": {"formula": "r_i=abs(relation(candidate_deltaL)-relation(authored_deltaL))/2", "tieEpsilon": 0.01},
    "aggregation": {"color": "decision-median->scene-mean->role-mean", "contrast": "applicable-decision-median->scene-mean->role-mean", "rank": "pair-mean->scene-mean", "system": "independent-no-pooling"},
    "composite": {"weights": {"color": 1, "contrast": 1, "rank": 1, "denominator": 3}, "error": "E_s=(D_s+C_s+R_s)/3", "score": "PairScore_s=100*(1-E_s)", "relativeImprovement": "I_s=(E_baseline_s-E_candidate_s)/E_baseline_s"}
  },
  "secondary": {"rawContrastError": "same-frozen-cells-uncapped-absolute-log2-error", "rankInversionRate": "fraction-of-frozen-pairs-with-loss-1", "tieMismatchRate": "fraction-of-frozen-pairs-with-loss-0.5", "accentHueError": "median-circular-degrees-over-eligible-authored-accent-rows", "accentChromaThreshold": 0.02, "lowChromaCandidatePenaltyDegrees": 180},
  "safety": {
    "comparisonEpsilon": 1e-7,
    "textContrastFloor": 4.5,
    "nonTextContrastFloor": 3,
    "surfaceSeparationFloor": 1.12,
    "hardFailureIds": ["text-contrast", "non-text-contrast", "surface-separation", "surface-rank-reversal", "native-dark", "restore", "extraction"],
    "operationalDefinitions": {"textContrast": "candidate_ratio+1e-7<4.5", "nonTextContrast": "candidate_ratio+1e-7<3.0", "surfaceSeparation": "candidate_ratio+1e-7<1.12", "surfaceRankReversal": "authored_relation_is_non-tie-and-candidate_relation_is-opposite", "nativeDark": "automatic-mode-adds-any-extension-owned-root-or-paint-mutation", "restore": "any-owned-attribute-variable-svg-resource-url-or-computed-paint-diff-remains", "extraction": "missing-extra-duplicate-or-unresolved-record-invalidates-the-run"},
    "severityDefinitions": {"F": "independent-automatic-invariant-failure", "H3": "content-or-control-unusable-meaning-changed-or-protected-media-destructively-recolored", "H2": "main-task-possible-but-primary-hierarchy-state-diagram-or-large-region-requires-disable", "H1": "local-aesthetic-hue-or-chroma-regression-without-meaning-readability-or-interaction-loss", "H0": "equivalent-to-or-better-than-baseline"},
    "reviewPolicy": "page-is-one-clustered-case-worst-state-wins-and-suspected-F/H2/H3-get-second-review",
    "severityOrder": "H0<H1<H2<H3; F-is-an-independent-invariant-failure",
    "candidateRegression": "new-failure-or-worse-margin-or-higher-page-severity-or-expanded-H2/H3-scope"
  },
  "m2Gate": {"minimumRelativeImprovementPerSystem": 0.1, "componentNonRegressionTolerance": 1e-12, "requiredSystems": ["carbon", "fluent"], "baselineZeroPolicy": "relative-gate-not-evaluable-and-fails", "requiredConditions": "I>=0.10-and-no-D/C/R-regression-and-no-new-or-worsened-F/H2/H3-per-system", "macroEligible": false},
  "reportContract": {"perSystemRequired": true, "systemMacro": "descriptive-only", "rowMicroAverage": "forbidden-for-selection", "manualSentinelLanguage": "no-veto-observed-not-statistical-significance"},